french,wolof
"J'en suis sûr, cette photo ci c'est la photo pris au moment où plusieurs personnes font une marche de révolte tendant leurs mains. Ceux là sont assis, ceux là sont debout entrain de marcher. On a écrit sur la photo quelque chose de bleu concernant la Casamance.",Waaw nataal bii nataal la boob ay nit ñu baree bari ñoo xam ni dañuy doxub ñaxtu ñoo ci nekk tàllal seen i loxo. Ñee sukku ñeel taxaw jodd di dox. Ñu bind ci kaw nataal bi lu xaw a baxa la bind ci laa kaasamãs.
J'arrive tout de suite chez toi.,Léegui léegui ma egg sa kër.
Je vois devant moi une photo sur laquelle beaucoup de personnes marchent pour se révolter. Ils ont plié leurs mains pour montrer une attitude pacifique.,Nataal bii maa ngi ciy janloog haa ay nit yu bari yuy dox di dox ab ñaxtu. Ñi ngi bank seen i loxo di wane ni lu amul benn taafar lañuy deme.
Ceux-ci sont des personnes qui sont sortis pour se révolter. Les marcheurs portent leurs habits blancs et leurs pantalons bleus et sont sur la route pour montrer leur colère. Ils écrivent au milieu une écriture française bleue.,"Lii, ay nit lañu yu génn di ñaxtu. Jëm yi nag ñu ngi sol seen i yére yu weex ak seen i tubéy yu baxa, nekk ci tali bi di wane seen aw naqar. Ñu ngi bind ci digg bi mbindum farañse mu baxa."
"Sur la photo, ont voit des personnes qui se révoltent ou qui s'opposent constamment aux gendarmes. C'était en Casamance. Ils ressemblent plus à des jeunes. C'était peut-être pour montrer quelque chose qui leur déplaisait.",Nataal bii ñoo ngi ciy gis ay nit ñuy ñaxtu walla di jàmmaarlook takk-der yi rekk. Caa Kaasamaas la woon. Aw ndaw lañ gën a nurool. Du ñàkk am lu leen metti ñu ko doon ñaxtu.
"On voit sur la photo beaucoup de personnes sorties sur la route, qui ont sortis leurs mains, les uns qui sont assis et lèvent leurs mains et écrivent, sur la photo, 'La Casamance', qui veut dire la région de Casamance.","Ñu gis ci nataal bi ay nit ñu bari ñu génn ci tali, ñu yékkati seen i loxo, ñenn ñi sukku yékkati seen loxo, ñu bind ci nataal bi 'La Casamance', mooy diiwaanu Kaasamaas."
"Je pense que la photo que je vois là, c'est une photo dans laquelle on voit une région qui est très jolie, vraiment jolie. Il semble même <mask>. En plus il y a de l'eau, des arbres verts, et tout le reste. En plus de cela, la région est très jolie et il y a du blanc à l'intérieur.","Man de nataal bii ma gis nii, nataal la boo xam ne ab dëkk bu rafet a rafet la, dëkk bi nag rafet na lool. Ba noppi mel ni yuñ ràbb daal, ba noppi am na ndox am na garab yu wert am yépp. Ba noppi dëkk bi rafet na lool daal am na lu weex."
Bonjour ! Ceci est une photo. Sur cette photo ci j'y vois une calebasse dans laquelle il y a des morceaux de sucre de couleur blanche. Il y a aussi des morceaux de sucre sur le sable et aussi une calebasse dans laquelle je vois un chat de couleur chocolat.,"As salaamaalekum! lii de ab nataal la. Nataal bii de gis naa si ab këll, këll boo xam ni ay suukër bekk la def bu am melo bu weex. Am na tamit ay suukër bekk yu nekk ci suuf, am na tamit ab këll bu may seen ci cat li boo xam ni dafa sokolaa."
"Ceci est une théière. Une théière dans la quelle on met du thé ou du café. Si tu regardes bien, il a une capture. La théière comporte une couleur 'orange' et 'jaune', oui. On le gère. Si tu regardes bien aussi, sur lui il y a un chameau dessiné ainsi qu'un arbre. On les a dessinés avec une couleur noire.",Lii nag baraada la. Baraada bu nu def attaaya la walla bu mën def kafe. Boo xoolee mi ngi am njàpp. Baraada bi nag mu ngi yor wirgo wu 'orange' ak lu 'jaune' waaw. Ñuŋ ko yor. Boo xoole tamit am na gëléem buñ ci nataal ak ay garab. Ñu nataal leen ak wirgo Wu ñuul.
"Ce que j'ai en face de moi, sur la photo, c'est une carafe. Une carafe en verre dans la quelle tu peut préparer tes jus. Celle-ci on dirait aussi que c'est du jus qu'on y a mis ; c'est une carafe en verre avec un couvercle noir. L'anse est de couleur noire. Ce qu'on y a mis aussi on dirait que c'est jaune, mais pas trop. Là où on l'a posé est complètement blanche.","Li may jàkkarlool ci nataal bi nag moom benn karaaf la. Muy karaafu weer boo xamente ne mën nga ci def say 'jus'. Bii mel na ne tamit ab jus lañ ci def mu nekk karaafu weer ak kubéer gu ñuul, jàppukaay bi daldi doon jàppukaay bu ñuul. Liñ ci def itam wirgo wi dafa xaw a soon waaye taxu ko soon noonu. Waaw fiñ ko teg daldi weex tàll."
"Sur la photo que j'ai, j'ai vu une sorte de chambre. La chambre est conçue avec de la terre d'argile. C'est-à-dire que c'est avec de l'argile qu'on l'a conçue, pas du ciment et en plus au-dessus il y a de l'herbes. Il y a beaucoup d'herbes et la terre a <mask>. La porte a une inscription qui dit qu'elle est faite de zinc. À coté de la porte il y a un genre pilon. Oui, la chambre est belle et bien faite en argile. Peut importe ce qui s'y passe c'est une chambre en argile.","Waaw nataal bi ma jot nag gis naa ne lu mel ne sãri néeg la. Néeg bi nag maanaam suuf gi ban lanu ko defare, maanaam ban lanu ko defaree, du simã ba noppi kaw gi moom am na ñax. Am na ay ñax mu bari ba noppi suuf gi am na yat. Bunt bi nag am na bind boo xam ne nuru na zinc. Ci wetu bunt bi lu mel ne sãri gënn mu ngi ci. Waaw néeg bi, néeg ban la daal. Lu ci mën ti xew néegu ban la daal moom."
Sur cette photo je suis en face de quelque chose qui est similaire au poisson séché. Cette chose est bonne dans le riz au haricot vert ; il s'agit bien du poisson séché. Le poisson séché on le met aussi là où on peut le saisir. Les plats comme la 'soupe kanji' ou tous ces autres plats où on peut le manger.,"Aa nataal bii de may jàkkaarloo mel na ni gejje la, gejj. Loo xam ne neex na ci ceebu ñebbe lool, muy gejje moom mii. Gejje itam bare na fanee fun ko mën à jëfandikoo, lu ci mel ne ay suppu kànja loolu yooyu yépp mën nan cee jëfandikoo gejj."
"Ceci est une photo sur laquelle je vois un poisson séché. Ce poisson séché semble énorme. Là où on l'a posé, auprès de la maison, est noirci.","Lii ab nataal la bob, nataal bi maa ngi ciy gis ag gejje. Géjje gi nag, gejje gi mel na ni réy na lool. Fi nu ko tek ca wet gale am na ay ñuul-ñuul."
"Sur cette photo ci, j'y ai vu des chambres faites d'herbes à l'intérieur d'une forêt <mask>. À l'intérieur tu verras d'énormes arbres. Il y en a aussi qui sont à peu près moyens et d'autres qui sont petits.","Nataal bii, gis naa ci ay néegu ñax yoo xam ne ñu ngi ci àll ci biiri gatab. Di deme ni nag ay garab la yoo xam ne, am na yu gudd lool, am na it yu xaw a yam am yu gàtt."
"Cette photo ci montre une maison qui contient des meubles, des fenêtres, des chaises et une natte étalée à l'intérieur.","Nataal bii day wane kër goo xamante ne dafa am ay meuble ci biir, am ay faneetar, am ay toogukaay ak genn basaŋ guñ lal ci biir."
"Oui ça, il semble que ce soit une fleur, mais la fleur ont l'a conçue avec une sorte de matière similaire au fer. La conception de ces fleurs est jolie.","Waaw lii de, dafa mel ni ab fulëer la, waaye fulëer bi liñ ko defare mooy lu mel ni màcceeru weñ moom lañ ko defaree. Def fulëer yi mu nekk lu rafet."
"À l'intérieur de cette photo je vois beaucoup de commodes placées contre le mur. C'est certainement pour garder des habits. Si ce n'est pas pour garder des habits, c'est pour garder des bols. Je crois que c'est une chambre ou une cuisine. Mais quoi qu'il en soit, les commodes sont très jolies car leur couleur est très jolie. La fenêtre qui est au-dessus, le fait que le vent passe à travers et entre à l'intérieur, est une bonne chose.","Ci biir nataal bii maa ngi ciy gis ay batã, batã yu bari yu sës ci miir bi nii. Xam naa boo moytuwul denculaayi yëre lay doon. Walla bu nekkul dencukaayu yërë mu nekk dencukaayu ay bool. Xam naa lii ab néeg la walla mu nekk aw waañ. Waaye daal lu ci mënti xew batã yi rafet nañ lool ndax wirgo wi mu ame nii dafa rafet lool. Ak palanteer bi nekk ci kow nee nga xam ni ngelaw lee ciy jaar di dugg lu baax la."
Je vois une large chambre avec un lit pour passer la nuit. Il y a de larges draps qui s'accordent à la période.,"Aa gis naa benn néeg bu yànj ànd ak ay lal, lalu fanaanukaay. Am ay drap yu yànj yu méngook jamono waa."
"Sur la photo qu'on m'a montrée, c'est une chambre. Il y a un lit qui s'y trouve avec un oreiller posé un drap blanc. La fenêtre comporte un tissu noir. Le lit a deux tiroirs au-dessous de lui.","Nataal bii ñu ma yónnee ab néeg la, am na lal bu ca nekk ak benn njegenaay lal ca darab bu weex, faneetar ba am na am na morceau bu ñuul. Lal bi am na ñaari turwaal ñi ngi ci suuf."
"Ceci ressemble à un bahut. Un bahut chocolat dans un espace blanc. Il peut contenir des livres, des tasses ou consorts. Il peut garder des objets de valeur.",Lii nag mel na ni benn baye la. Baye bu sokolaa la nekk ci barab boo xam ni dafa a weex. Mën naa def yu mel ni ay téere Walla ay kaas walla yu mel noonu. Mën naa denc yu am solo.
Sur la photo que vous m'avez envoyée il y a deux bancs avec chacun pouvant contenir deux personnes. On les a conçus avec du fer. Au milieu il y a un matelas et un <mask> posé dessus. Il y a une table qui est également posée à coté.,"Nataal bi ngeen ma yónne nii de ñaari baŋ lañ yoo xam ni bu ci nekk ñaari nit mën nañ cee toog. Ñuŋ leen liggéeye weñ, digg bi am matlaa ak ndima luñ ci teg . Am na taabal ju tege itam ci wet gi."
"Je sens que ceux-là sont, vraisemblablement, des ustensiles de cuisines. Il y en a de différentes couleurs. Il en existe avec des couleurs vertes, des couleurs bleus, il y a du jaune, et aussi du rouge. Il y a aussi des couleurs vertes, et aussi d'autres couleurs. Ce sont des ustensiles de cuisines, assurément.","Waaw lii de ay xeeti toogukaay la, ay xeeti toogukaay nag. Am na ay wirgo nag. Am na ay wirgo yu wert, am wirgo yu bula, am na mboq, am tamit ëe xonq, am na tamit ëe wirgo yu wert, am tamit yeneen wirgo daal. Ay toogukaay la, ay toogukaay lay doon."
"Ceci est ce qu'on appelle une douche, qu'on a conçue de manière méthodique.","Lii de lañuy tudde wanag, ñu defar ba mu muccu ayib."
"À l'intérieur de la photo, j'ai vu trois beaux et jolis paniers tissés. Il y en bien trois. Il y en a un de plus grande taille, un de moyen et un autre plus petit. Chacun d'entre eux a, à son intérieur, un couvercle. Au-dessus du couvercle, il y a quelque chose qui ressemble à un chapeau. Tous les trois paniers ont des anses accrochées à leur coté. Il s'agit des cordes avec lesquelles on les attrape.","Biir nataal bii gis naa fi ñetti pañe yu ñu ràbb ràbbin wu fatt te rafet ñett lañ nag. Am na bu ci gën a mag am bu ci gën a mag tuuti am bu ci gën a ndaw. Ñoom ñépp nag am nañu kubéer ci biir kaw kubéer gi nag am na lu ci nekk cat la mel ni mbaxana. Ñoom ñetti pañe yépp am na ay jàppukaay, jàppukaay yu ñu lonk ci wet yi , ñaari buum yun leen di jàppe."
J'ai vu quelque chose qu'on achète au marché...,Gis naa benn affaire bu ñuy ndugge marché...
"Sur la photo que vous m'avez envoyée, j'y ai vu une jolie porte conçue avec du bois et du verre. Il y a au-dessus de la porte une lumière qui éclaire.","Nataal bii ngeen ma yónnee de, gis naa ci biir nataal bi ab buntu bu rafet ñu liggéeyee ko dénk ak weer. Am na ca kaw bunt ba limiyeer buy leer"
"Sur cette photo ci, il y a des pierres qui sont rassemblées. Cependant, les pierres ont des trous à l'intérieur ainsi que des pointes. Elles semblent de couleur marron.","Waaw nataal bi de, ay xeer la yoo xam ni dañ dajaloo. Xeer yi nag Daf am am ay pax-pax ci biir, am ay cat-cat. Dafa xaw a marõ."
C'est des enfants qui jouent avec leurs jouets. Les enfants sont entrain de jouer avec leurs jouets. C'est des enfants qui jouent.,"Xale yuy fo la, yor seeni fowukaay. Xale yi dañuy fo, yor seeni fowukaay. Ay xale yuy fo la."
"Ce que tu m'as envoyé jusqu'à maintenant, la plupart sont des objets utiles. Il y a une théière, une machine de chauffage et un récipient.","Li nga ma yónnee ba tey, li ma ci gis ay jëfandikukaay la, baraada la ak mësin pour tàngalukaay ak xellikaay la."
J'ai vu ici une photo sur laquelle il y a un lit. Il est chocolat et a deux portes. Il y a aussi quelque part où on peut s'appuyer. C'est ça que j'y ai vu.,Gis naa fi ab nataal bo xam ne ab lal la. Boo xam ne daa sokolaa am ñaari tànk. Am na wéeruwaay tamit. Loolu laa fi gis.
"C'est cela qu'on appelle un berceau. Il est conçu avec du bois. À l'intérieur de ce berceau, cependant, il y a une sorte de drap blanc avec un oreiller. À l'intérieur de l'autre, on y a étalé quelque chose de couleur chocolatée ; un drap chocolat.","Waaw lii lañu naan beerso. Dénk lanu ko defaree, dénk. Benn beerso bi nag ci biir lu mel ne xeetu darab bu weex moo ci nekk am benn njegeñaay. Beneen bi nag danu cee lal lu mel ne lu sokolaa ; darab bu sokolaa."
C'est l'entrée de Louga. C'est à la frontière de Louga que tu entres pour montrer que tu habites à la région de Louga. Louga fait partie du Sénégal. C'est ça qu'il représente au Sénégal.,"Lii duggukaay bu Luga la frontière bu Luga fii ngay dugg pour ñu wan la yaw mii nii yaa ngi dëkk biñ naan Luga. Luga nag ci Senegaal la bokk, ab lii la ci Senegaal."
"Sur cette photo il semble qu'il y est un tableau d'art. C'est ce qu'on fabrique ensuite qu'on réécrit et qu'on dessine. J'y vois aussi une personne dont j'ai l'impression que c'est un homme à qui on a donné une très grosse tête. La bouche est ouverte est contient des dents blancs. Des yeux minces, aussi. Les yeux, aussi, sont ouvertes et une perle noire se trouve à coté. À coté se trouvent des trucs blancs. Tu vois le nuque qui est complètement enfoncé. Derrière la tête, aussi, on dirait qu'elle est rasée avec une teinture noire. On l'a carrément peinte en noire.",Waaw nataal bii nuru na ma ab li ñiy tudde ab tableau d'art. Mooy ñi nga xam ni dañ leen di defar daldi leen di bindaat daldi leen di dessiné. Mi ngi may jox benn waay it koo xam ni góor la may nirool ñu def ko bopp bi rëy lool sax gémmiñ gaa ngi ubbéeku mu am ay bëñ yu weex ca biir ay bët yu sew it bët yi tamit ubbéeku na mu am per bu ñuul kukk am ci wet gi ay lu weex nga gis doq gi mu xaw a nóox lool. Am tamit ci ginnaaw mu mel ni dañ koo wat amaale lu ñuulaale ñu daldi ñuulal ginnaaw gi lool sax lool lool.
Ceux-là sont des garçons montés sur des chevaux et portant des bâtons et allant en des directions différentes.,"Ñii de ay góor lañu, ñu yéeg ci ay fas yor ay bant wutali fa ñu jëm."
"Celui-là que tu vois c'est le dirigeant du pays, Macky Sall. Il est là-bas dans le véhicule, levant ses bras. Actuellement, les policiers et les gendarmes le suivent. Les suiveurs le garde, montrant leurs véhicules eux aussi. C'est le dirigeant du pays qui se trouve au-dessus, dans le véhicule noir, entrain de lever ses bras.","Kale ngay séen njiitu réew mi la, Maki Sàll. Mi ngi nekk noonu ca kaw ndaamar ga, yékkati ay yoxoom. Leegi nag, polise yeek sàndarm si topp ko nii, toppekat yi di ko gàrde, war seeni ndaamar ñoom it. Njiitu réew mi moo nekk nee ca kow, ci ndaamar gu ñuul gi yékkati ay yoxoom."
"Sur cette photo, il y a un gendarme monté sur une moto. Derrière lui, les autres gendarmes sont debout entrain de le regarder.","Nataal bi ab takk-der la waaw, yéeg ci benn móto waaw. Ci gannaawam yeneen takk-der yi ñi ngi taxaw di ko xool."
Sur cette photo il y a le Capitaine Seydina Omar Toure. C'est lui qui était à la section de recherche et qu'on a ensuite radier.,nataal bii Capitaine Séydinaa Omar Ture la. moo nekkoon section de recherche ñu radier ko.
"Sur cette photo, c'est une personne de couleur blanche, assise sur une chaise noire. Le dossier de la chaise, là où tu poses ta tête, comporte des écritures blanches. La personne a, cependant, superposé ses deux mains au-dessus du menton. La personne porte des habits de gendarme. C'est-à-dire des habits qui ont...","Nataal bii mu ngi nekk ak nit, nit ku xees, ku  toog ci baŋ bu ñuul. Wéerukaayu baŋ bi, ci fi ngay tegee sa bopp, ni am ay bind yu weex. Moom nag mu ngi tegle ñaari loxoom yi tiimale ko ci sikim bi. Nit ki nak mu ngi sol yéreeg takk-der. Maanaam yére bu am..."
"Jusqu'à présent, on voit sur la photo des soldats. Les soldats sont au nombre de douze ou treize. Les soldats sont au niveau du palais. Personne ne touche au palais. Par contre, ils ne rient pas et ne jouent pas. Ils ressemblent à des personnes sans émotions. Derrière eux on voit la porte du palais. La porte du palais est vraiment jolie. Il y a un tapis rouge, deux lions, et derrière, il y a quatre drapeaux Sénégalais. Par contre, parmi les soldats, il y en a deux qui portent leurs habits bleus et leurs pantalons noirs. Pour ce qui reste, cependant, ils portent la même chose. Ceux là portent leurs chapeaux rouges, un truc noir dessus, leurs pantalons noirs et leurs bâtons. D'autres portent leurs gangs pour pouvoir garder notre dirigeant.","Ba tey ñoo ngi gis ci nataal bii ay soldat. Soldat ñu ngi tollu ci fukkak ñaar ba fukkak ñett ci ay soldat. Soldat ya nga xam ne ñoom ñu ngi nekk ca palais ba. Kenn du laal palais bi. Ñoom nag duñ ree duñ kaf. Dañuy mel ni ñu amul xol. Seen ginnaaw ñoo ngi gis buntu palais bi. Buntu palais bi rafet lool am benn tapis bu xonq am na ñaari gaynde ci ginnaaw am na ñeenti drapeau Senegaal. Ñoom nag, waa Soldaar yi, am na ñaari soldaar yoo xam ni ñi ngi sol seen i ay yére yu bula ak seen i tubéy yu ñuul, bu fekkee ñi ci des nag ñoom ñoo bokk lenn lañ sol. Ñii sol seenum mbaxana mu xonq am lu noir am lu ñuul  ak seen i tubéy yu ñuul yor seen i ay yar, ñee sol seen i gã ngir mën a gardé suñu njiit bi."
"Sur cette photo ci, j'y vois des gendarmes portant des armes et un casque sur la tête. Il y a un homme allongé ici. Ils semblent se diriger vers lui.","Nataal bii maa ngi ciy gis ay takk-der yu yor ay ngànnaay takk ay casque. Am na it góor gu tëdd nii, ñu mel ni ñu jëmsi ci moom."
J'ai vu ici des gendarmes qui portent leurs tenues et des boucliers sur les genoux pour se protéger.,"Gis naa fi ay takk-der yoo xam ni ñoo ngi solu seen i tenue, uuf seen i baaraas pour aar seen bopp."
"Ça c'est un terrain de jeu, c'est-à-dire un très joli stade de jeu avec des lampes allumées en haut tout autour comme s'il y avait quelque chose de noir au dessus entouré de lampes très lumineuses. L'intérieur était une place dans lequel des gens jouaient au football.",Waaw lii ab fowu la maanaam stade fowu fowu la bu rafet lool làmp yiy tàkk nii nekk ci kawam mu wërngalu nii am lu ñuul lu nekk ci kaw loo xam ne daa daa wërngalu làmp yi di leer nàññ ci kaw fowu bi nekk ci biir mu doon loo xam ne sii ci biir dees ci futbalees.
"Cette photo ci est une photo sur laquelle il y a un magasin. Cependant, ce magasin est une sorte de coiffeuse dans le quel tout est de couleur chocolatée. Il y a du chocolat et du blanc, oui. Il a des tiroirs et tout le reste et est de couleur chocolatée.","Nataal bii de nataal la boo xam ne ab ab am mangasin. Mangasin bi nag ab coiffeuse la, coiffeuse bi biir bi daa sokolaa lépp daa sokolaa daa am i sokolaa am yu weex waaw. Daa am ay tiruwaal ak yépp ba noppi mu sokolaa."
"Sur cette photo, il y a une chose qui ressemble à une salle. La salle aussi j'y vois ce qui ressemble à un petit lit accompagné à ce qui semblent être des canapés très confortables. Je vois aussi attaché au-dessus <mask> et un dessin <mask>. Un dessin qu'on a mis sur le mur.","Nataal bii de ab salle lay nuróol, salle bi tamit maa ngi ci gis lu mel ni ab lal bu ndaw maasàllaa lu mel ni ay canapé yoo xam ne neex naa toog lool. Maa ngi gis tamit ñu takk panal ci kaw akub dessin tubaarikàlla, dessin yoo xam ne dañ koo dessin ci miir bi."
"Ceci, cependant, est un bol. Il y a du sucre dans le bol. Le sucre tu le perçois qui est tout blanc et remplissant le bol. Le sucre est propre et très jolie même.","Lii nag ab bool la. Bool bi suukar la def. Suukar Si nag yaa ngi koy séen lu weex tàll, fees dell ci bool bi. Suukar Si set te rafet lool sax la."
"Ceci est une maison. La maison est, cependant, constituée de trois étages. Tu peux passer d'étage en étage. La maison comporte beaucoup de portes et <mask>, des fenêtres à travers les quelles le vent passe dans la toute la maison. Elle comporte des arbres qui s'érigent au-dessus de la maison qui <mask>.","Lii ak kër. Kër gi nag ni lu bindoo tegale gi ñetti tegale la ci tabaxin bi. Nga mën a yéeg ci kow yéegaat ci kow jàll. Mi ngi am ay bunt yu beree bare ak i tofla, ay fëneetar yoon xam ni ngelaw Li da cee mën a jaare ci biir kër gi. Mi ngi am ay garab yu naatal kër gi ci wer ci."
"Sur cette photo, il y a d'une salle dans la quelle sont posés des bancs rouges avec des fleurs constituées de lampes allumées de sorte à ce qu'elles soient jolies; Dieu l'a voulu.",Nataal bii nag benn salle la bu ñu teg ay bã yu ruus def ay fleurs taal ay làmpu décoré ba mu rafet maasàllaa.
"Sur cette photo ci que je vois il y a des personnes qu'on a fabriquées avec des arbres, des fleurs et consorts. Ils sont dans un endroit très beau avec des murs les entourant. Des murs peints avec de la peinture jaune.",Nataal bii ma gis de ay nit yun tabax la ak i garab ak i fleur ak yooyu. Ñu nekk fu taaroo taaru am miir bu leen wër miir boo xam ne peinture bu soon lañ ko peinture.
"Sur la photo que j'ai vue, j'y ai vu une jolie maison, et un arbre à la porte de cette maison.","Nataal bii ma gis, gis naa ci ag kër gu rafet, am ag garab ci buntu kër gi."
"Ceci on dirait que c'est une théière, une théière rouge sur la quelle on a dessinée des arbres. Les arbres ont une couleur noire sur les quelles, se trouve, on dirait, une gazelle. La gazelle est de couleur noire.","Lii de daa mel ni ab baraada la, baraada bu xonq ñu diseene ci ay garab. Garab yi nag ñi ngi am wirgo yu ñuul am lu mel ni ag kéwël, kéwël gi mi ngi am wirgo yu ñuul."
"Ceci est une théière ; une théière sur la quelle on voit une gazelle et deux arbres. C'est une théière rouge. On utilise la théière pour cuisiner, chauffer de l'eau ou tout autre chose que les gens boivent.","Lii ab baraada la ; baraada boo xamente ne ñu ngi ciy gis genn kéwél ak ñaari garab. Baraada bu xonq la. Baraada nag dañu koy jël di sí togg, di si tàngal ndox walla loo xamente ne nit ñi dañu koy naan."
Ceci est un ancien milieu avec une construction en ruine. Des ombres et les rayons du soleil en sortent. C'est ce qui s'y passe.,"Lii ab milieu la, milieu bu yàgg milieu boo xam ne sii tabax boo xam ne si nii daa yàqu tàkk-ndeer yi di ci génn céññéeri jant bi di ci génn. Moo ci nekk."
Sur cette photo on voit ce qu'on appelle 'poisson séché' au Sénégal. Il s'agît d'un poisson qu'on accroche jusqu'à être sèche et ensuite qu'on met du sel et consorts. Après on cuisine avec.,Nataal bii nag ñuŋ fi gis lu Nga xamante ne moom la nuy woowe gejje fii ci Senegaal. Mooy jën wi Nga xam ben dañ kaa jël weer ko ba lu Wow def ci ay xorom ak yooyu. 'Après' moom na ñuul di ko togg.
Sur la photo que j'ai eue a voir il y a assurément un poisson séché. C'est bien un poisson séché que j'ai vu.,"Nataal bi ma jot de gis naa ni gejje la, waaw gejje. Gejje de laa gis."
"Oui mon parent, je vois que ça c'est des pots de Nescafé dans lesquels il y a du café. J'y ai vu des graines de café mûrs et d'autres qui ne le sont pas. J'y ai vu aussi du café en poudre sur le coté.","Waaw mbokk mi, gis naa ni lii de ay potu Nescafé ñu def ci café. Gis naa ci ay doomi café yu ñor ak yu ñorul. Gis naa ci café gu mokku tamit ci wet gi."
"Sur la photo que vous m'avez envoyée, j'ai vu, à l'intérieur, des cases, des plantes prospères et des escaliers qui sont sur le coté.","Nataal bii ngeen ma yónnee de, gis naa ci biir nataal bi, néegu ñax, gàncax gu naat ak yégukaay bu nekk ci kote bi."
Sur cette photo il y a des gens qui sont assis dans un domaine et qui font quelque chose. En plus ils sont bel et bien assis dans un domaine entrain de travailler.,Nataal bii de nataal la boo xam ne ay nit la yu nekk ci benn bërëb toog fa ba noppi am lu ñuy def. Ba noppi toog ca bërëb ba di am lu ñuy liggéey waaw.
"Ceux-ci sont de vieilles cases à l'intérieur desquelles des personnes marchent. Ceux qui ont froid, ils la couvrent avec une façade, des bâtons et des arbres.","Lii ay néegu ñax la, néegu ñax yu màggat ay nit di ci dox ci biir. Am na yi nga xam ne si nii dañ liiwe ay sàkket dañ ko muure ay sàkket ak ay bant ak ay garab."
