french,wolof
"Oui, ceci est une chambre. Une large chambre dans lequel, on peut dire que, trois personnes peuvent s'y coucher. Car en bas, deux personnes peuvent s'y coucher. En haut, une seule personne peut s'y coucher. À coté, on a un rideau qui est complètement teint en rose, rose claire et rose foncée. En haut, sur le lit, pour pouvoir monter, il faut une échelle. Une échelle est un outil qui a des marches. Chaque marche sur lequel tu mets ton pied, tu montes encore plus. De l'autre coté du lit, à coté de l'échelle, on a des tiroirs. Un tiroir est un outil qui te permet de garder tes objets. C'est sûr.","Waaw, lii nag moom lal la. Benn lal gu yànj boo xam ni mën nañ ne, ñetti nit ñoo siy dallu. Ndax si suuf, ñaari nit man neñ faa dallu. Ci kaw moom, ben nit rekk moo fa man a dallu. Ci wet ga, ñoong fa am benn rideau, rideau boo xam ne manees nañ ne couleur bu roos la am, roos claire ak roos bu foncée. Ca lal gi ca kaw moom, pour nga yegg ca, il faut, ëe... benn lu ñuy naan echelle. Echelle nag nekk benn juntukaay boo xam ne ay tànk la am, bole tànk boo teg di daal di gën a yéeg. Ca beneen wetu lal boobu nag moom, ca wetou echelle ba ñu ngi am ay tiroir. Tiroir nag nekk na benn juntukaay boo xam ne da lay tax nga fay denc say yëf. Waaw."
"Sur cette photo, c'est <mask> dans laquelle on garde des tasses et consorts. On l'a conçue avec du bois et du verre de manière méthodique.",Nataal bii lii ab àngal la boo xam ne dañ ciy deñci ay kaas ak yu ni deme. Ñu defare dénk ak weer defar bu mucc ayib.
Sur cette photo ci il y a une porte avec des couleurs blanches et du verre. À coté du verre il semble y avoir d'autres bouts de verres de couleur blanche. Le verre c'est du bois. Il y a assurément du bois et du verre.,"Nataal bii de nataal la boo xam ne ab bunt la boo xam ne bu am lu weex la am ay weer. Weer yi daa xaw a am yeneen weer yu nekk ci wetam yoo xam ne yu weex la. Weer yi dénk la, am na dénk ba noppi am weer waaw."
"Ceci est un four. C'est ce qu'on appelle une cuisinière. Le four, on l'allume et cuisine avec. Après avoir l'allumer, tu dois ensuite y poser la marmite et commencer à cuisiner ce que tu veux.","Waaw lii nii ab ab puur la. Waaw moom lañuy wax cuisinière. Ab puur la dañ koy taal di ci togg, boo ko taalee danga ciy teg cin li rekk togg ci li nga bëgg a togg."
"Sur cette photo ci, j'y aperçois du beurre ; il s'agit d'un beurre qui semble être congelé et qu'on a posé sur une table. Il y a une chose de couleur blanche sur lequel est posé le beurre. Un couteau est posé dessus et le coupe.","Waaw ëe nataal bii nii maa ngi ciy seetlu bëer ; bëer bu xaw a 'congelé' boo xamente ne dañ koo teg si benn taabal. Am lu nu lal lu weex daldi siy teg bëer bi, teg si paaka bi di ko dagg."
"Ceci est une bouche qu'on a conçue, dans laquelle on a mise deux endroits pour se laver les mains et ouvert le robinet pour le laisser couler.",Waaw lii nag aw saañ la wuñ tabax ba noppi def fa ñaari raxasukaay tijji robinet bi muy sotti.
"Ici, cependant, il semble qu'il y est une porte, une jolie porte. En plus il semble qu'elle soit fermée. Parce que, si tu regardes bien sa position, on l'a tirée jusqu'au fond... jusqu'à ce qu'elle soit serrée. Par conséquent, pour pouvoir y entrer, il faut qu'on t'ouvre ou bien que tu ailles tenir ce fameux levier pour pouvoir entrer à l'intérieur.","Bii nag, mun mel ni benn bunt moo fi ne. bunt bu rafet. Te niñ ko wonee sax dafa mel ni dañ ko téj. Ndaxte boo seetee nu mu mel, dañ ko xëcc ba mu sës... mu serré. Ba tax na, dafa mel ni sax pour nga dugg fa, faaw ñu ubbi la wala sax nga ñëw tiyé ci levier boobu noonu bi ñu wone pour nga man a duggu ci biir."
"Sur la photo qu'on m'a envoyée, j'y ai vu un cadre avec des chaussures. Il y a des chaussures de garçon mais aussi des chaussures fermées.","Nataal bii ñu ma yónnee gis naa ci ab kaadar def ay dàll, dàll yoo xam ne ay dàlli góor la, dàlli fermé yi tamit mi ngi ci."
"Sur ma photo qu'on m'a envoyée, il y a apparemment une chaise, sur laquelle on s'assoit. Mais, elle est clairement de couleur bleue.","Sama nataal bii ñu ma yónnee dafa mel ni ab sées la, sées yi ñuy tooge. Waaye nag couleur bi moom dafa bula couleur bu bula la."
"Sur cette photo, je suis face à une chaise peinte avec de la couleur bleue. Ce siège ci, il semble qu'il soit complètement tissé. C'est ce à quoi je suis face sur la photo qui est devant moi.",Nataal bii maa ngi ciy janook 'chaise' bu nu liggéeye niki lu xaw a baxa. Moom toogukaay bii. Mel na ne yit ëe toogukaay la bu nu ràbbale ba fatt. Moom laay janool ci nataal bii ma janool.
"Ceux-là, cependant, sont des cases. Celle qui est en haut est conçue d'une très belle manière. L'autre aussi est conçue en prenant une charge et l'entourant autour et en lui fournissant une porte.","Waaw lii nag ay néegi ñax la, néegi ñax bi ci kaw dañ kaa defar ko bam taaru lool. Bi ci des tamit ñu defar ko jël ab sars wërale ko ci kaw wutal kob buntu."
"Ceux-là sont, semble-t-il, des paniers de course. Il y'en a qui sont en gris, d'autres qui sont bleus. Ils sont posés au-dessus d'un lit ou d'une moquette. Je suis sûr que la femme a qui on va les donner va bien faire ses courses.","Waaw lii de ab ëe ay kii la ay pañe la, pañe ndugg.  Am na yu mboq, am na yu baxa ñu teg ko ci kaw lal walla kaw moket moket. Xam naa ne ku ko jox jigéén dana si ndugg bu baax."
"Ceci, cependant, on a l'habitude de faire les courses avec. C'est-à-dire que quand les femmes vont au marché, c'est ça qu'il emporte avec elles. On l'appelle en français 'panier'. On le porte et y met des marchandises comme le poisson, aubergine, chou pommé, citrouille... C'est à peu près ça qu'on met dedans en tout cas.","Lii nag dañ ciy faral di def ndugg maanaam jigéen ñi bu ñuy dem ja marse ba ëe, moom lañuy yor. Ñu koy woowe ci farañse pañe.. Dañu koy gàddu nag. Buñ ko gàddoo dañu ciy def lu mel niki ay ndugg daal lu mel ne jën, batañse,suppome, naaje... Yooyu daal lañuy def ci biir."
"Ceci est un long bâtiment blanc. Il contient beaucoup de climatiseurs. Six climatiseurs apparaissent ici. En bas, six climatiseurs y apparaissent. On a étalé une table à manger rouge; des gens, vêtus de rouge, l'entourent. Mes hommages. Vous allez bien ?","lii daal, am taax la mu gudd mu weex. bari lool ay ubbi féexal. ci kaw, juróom benni ubbi-féexal feeñ na fi. ci suuf, juróom benni ubbi-féexal feeñ na fi. ñu lal laltu bu xonq, ay nit yu sol lu xonq séq ko. waaw noo ngi ziyaar. yaang ci jàmm?"
"Sur cette photo se trouvent deux présidents. Ici, c'est en France. Il s'agît des présidents Macky Sall et Macron. Ils sont là, marchant sur un tapis rouge. Il y a des voitures qui sont derrière eux. Il y a des personnes debout à leur coté portant ce qui semble être des fil électriques; ce sont des policiers. Macky Sall et Macron, chacun d'eux porte des habits et des chaussures noirs  <mask>.",Nataal bii de ñaari président la. Fii nag France la mu di président Maki Sàll ak Macron ñi ngi noon di dox ci affaire bu rouge bi. Am na oto yu topp seen gannaaw. Am na ñu taxaw seen wet yor lu mel ni ay fiil ay policier lañ. Maki Sàll ak Macron ku nekk sol yére bu ñuul ak dàll yu ñuul kostin.
"Sur cette photo datant d'il y a huit ans, j'y ai vu du couscous qu'on a préparé. Après l'avoir bien préparé, il s'accompagne de sauce qui est mélangée avec.",Juróom-ñetteelu nataal bi seetlu naa ci cere joo xam ne dañ koo defar. Biñ ko defaree bam noppi mu àndak ñeex moo xam ne moom lañ koy siife.
"Oui encore, je vois que ceci est une automobile. Une automobile qui ne bouge pas. Des gendarmes sont à l'intérieur. Il y a un gendarme qui est devant. Oui c'est ce que j'ai vu.","Waaw ba tey lii de gis naa ne ag daamar, daamar gu taxaw la, ay sàndarma ñi ngi ci biir daamar ga, am na benn sàndarma bu nekk ca kanam. Waaw loolu de laa gis."
"Oui sur cette photo ci aussi, j'y ai vu un bol blanc dans lequel on a mis du 'caakri' avec du raisin au dessus et posé sur le sol. C'est ça que j'y ai vu.","Waaw nataal bii tamit de gis naa ci benn bool bu weex ñu def ci caakiri def rasin ca kaw, teg ko nii ci suuf. Lool daal laa gis."
"Sur cette photo ci, j'y vois quelqu'un portant le drapeau du Sénégal. Il semble que c'était, cependant, une marche de révolte. Il a coupé ce qui ressemble à une datte, un cocotier rouge, et l'a posé au milieu de la route. Ceux-là ont des vélos, ceux-là marchent avec leurs pieds.","Nataal bii maa ngi ciy gis ku yor raaya Senegaal. Daa mel ni ab nag doxu-ñaxtu la doonoon. Dagg lu mel ne tàndarma, garabu koko bu xonq, teg ko ci digg tali bi. Ñii yore 'velo', ñii dox ak seen tànk."
"Salut ! Ceux-là qui ressemblent à des personnes qui habitent en Casamance, un pays qui est au Sénégal, eux sont ceux qui montrent cette colère, se lèvent comme ça, les uns assis, les autres debout, prenant leurs mains et les rassemblant pour montrer leurs mauvais humeur. Ils sont assis sur la route.","Salaawaalekum ! Ñii de, mel nañ ne, ay nit ñu dëkk kaasamaas, benn dëkk bu nekk Senegaal, ñoom ñooy wane seenuw naqar nii, daldi taxaw nii, ñenn ñi toog, ñenn ñi taxaw, jël seen loxo yi dajale ko ngir wane seenuw naqar. Ñoo ngi toog ci tali bi."
"Cette photo ci c'est une photo sur laquelle je vois des jeunes du pays qui semblent en colère contre ce qui s'est passé dans leur pays et que les anciens les ont laissés. J'en vois, même, qui portent des habits blancs et des pantalons noirs. Beaucoup parmi eux portent des habits noirs et blancs, et d'autres portent des habits blancs. Ils sont levés sur la route, qui elle semble remplie de pierres qu'ils ont, peut-être, utilisé pour se battre contre les gendarmes. Au-dessus de la photo j'en vois qui écrivent quelque chose d'arrogant. Ceux qui habitent en Casamance l'appellent Sigicor.","Nataal bi ab nataal la boo xamante yni maa ngi ciy gis ay ndawi réew yoo xamante ni daa mel ni dañuy naqarlu loo xamante ni xew na ca seen réew te seen njiitu réew teg leen ko. Maa ngi ciy gis nag ñoo xamante ni dañoo sol lu weex aki ay tubéy yu ñuul. Bari ci ñoo xamante ni sol nañu yoo xamante ni ay yére yu ñuul la ak yu bula, am na yit ñu sol yu bula. Ñu ngi taxaw si kow tali tali bi nag xaw naa bari ay xeer ńàkkul ni ñoo ko jëfandikoo ngir jàmmarloo ak way takk-der yi. CI kow nataal bi maa ngi gis ñu bind si bind boo xamante ni réewu, dëkk bi nu naan Kaasamaas ñu koy wax Siggicoor."
"C'est des poissons, oui. Ils sont de couleur bleue ou rouge.","Jën la waaw, Wu am wirgo Wu baxa ak Wu xonq."
"Ah sur cette photo ci cependant, il y a un poisson. Il existe trois couleurs pour ce poisson. La première couleur est la jaune, ceux qui suivent sont le bleu et le blanc. Ce sont de jolis poissons.","Aah nataal bii nag, aw jën la. Jën wi mi ngi ame ñetti wirgo. Wirgo Wu jëkk Wi mboq la, Wu ci topp di bëlë, Wu ci topp di weex. Muy jën wu rafet."
"Cette photo ci est celle d'un couteau. Un couteau pour lequel il y a du bois à côté ainsi que du fer. Ce qui est sur cette photo ci on l'appelle couteau. C'est un vieux couteau de couleur chocolat. Oui, c'est comme ça qu'il est.","Nataal bii de, nataal la boo xam ne ab paaka la, paaka boo xam ne paaka bi am na dénk ca wet ga ak weñ waaw. Nataal bii daal paaka lañ koy wax paaka bi daal beesul te daa chocolat waaw noon la mel."
"Ceci est un long et jolie bâtiment. On a vu deux personnes à sa gauche, un homme et une femme allant ensemble avec des médicaments et des fleurs. À sa droite on a vu un bâtiment blanc avec des voitures devant. Le bâtiment est sur la route.",Lii ab tabax bu njool la bu rafet. Gis nañ ñaari nit ci càmmooñ bi benn góor ak benn jigéen ñu ànd ak ay garab ak fleurs. Ci ndey-joor bi gis nañ benn tabax bu weex ak ay oto ci kanamam. Tabax bi mi ngi ci kaw tali.
"Sur cette photo, il y a un homme et une femme, des statuts debout auxquels sont attachées des chaînes. Comme si ils étaient des exclaves.",Nataal bii góor ak jigéen ay statut yu taxaw ñu takk leen ak ay chaîne. Mu mel ni ay jaam lañ daal.
"Sur cette photo, on y voit un morceau de sucre. Un morceau de sucre qui est sec. Il peut aller dans le café, il peut aller dans d'autres et d'autres choses... Il peut aller dans le lait et il peut aller dans tout. On l'a mis dans un bol, un bol en chocolat... On a mis beaucoup de morceaux de sucres dedans.","Nataal bii nag ñu ngi ci gis bekku suukër. Bekku suukër, ëe suukër la ju wow. Ëe moom day dem ci kafe dina dem ci yeneen yeneen... Mën naa dem ci soow ak yépp mën na see dem. Ñooŋ kay def si benn bool, ëe ci benn bool bu sokolaa... Def si bekk suukër yu bëre."
"Sur la photo, que vous m'avez envoyée, il y a une petite case dans la quelle il y a trois chambres. Il y a aussi beaucoup d'arbres. Il y a des gens qui sont assis là-bas au-dessus l'arbre. Il y a des gens qui sont sur la route en train de marcher. Il y a trois cases. Chacune d'elles a une nappe ou un rideau bleu.",Nataal bi ngeen ma yónnee de ab dëkku àll bu ndaw la boo xam ne ñetti néeg ñoo fa nekk. Te am na ay garab yu bari. Am na ay nit yu toog nële ca garab ga. Am na nit ñu nekk nii ci yoon wi di dox. Néegi ñax yi ñett la. Am nap ab rido bu bula.
"Ceci est une tasse et une assiette. On y verse le café, mais aussi, elle est de couleur blanche ; la tasse est blanche, l'assiette est blanche. Si tu regardes à coté tu verras du café renversé sur le bois et du café qu'on a mis dans ce qui ressemble à un sachet.","Lii nag ëe kaas la ak palaat. Nu ciy xelli kafe gi waaye moomit dafa weex, kaas bi dafa weex, palaat bi weex. Boo xoolee ci wet gi dinga gis kafe gu tuuru ci kaw dénk bi ak kafe bu nu def ci lu mel ne mbuus."
"Cette photo ci, c'en est une sur laquelle on est dans un domaine. Un domaine dans lequel il y a beaucoup de filles. Ce domaine là est très joli.",Waaw nataal bii de nataal la boo xam ne nataal bii ñi ngi nekk ci ab bërëb. Bërëb boo xam ne ay xale yu jigéen yu bari bari ñoo fa nekk. Bërëb bi nag bërëb bu rafet la.
"Ceci est une chambre couverte d'herbe. En le couvrant d'herbe, la chambre est une sorte de chambre. La chambre est couverte d'herbe, des arbres en haut, des arbres en bas. Il y a beaucoup d'arbres tout de même.","Lii ab néeg la, néeg bi dañ kaa xadde ñax. Biñ ka xaddee ñax, néeg bi ab néeg la, néeg bi ñu xadde ko ñax ay garab nekk ca kaw ay garab nekk ci suuf. Bari nay garab lool nag sax."
"Mes salutations les plus sincères. Toujours, sur la photo, on voit une case. Personne n'habite dans la case. Car en regardant bien on l'a peinte avec deux couleurs. Ils s'agissent de la couleur blanche et de la couleur chocolatée. Au-dessus, on y a posé des herbes. Devant la case, on voit deux enfants. L'enfant, le plus âgé, porte l'autre. Devant eux, on y voit un arbre. L'arbre est couvert de fruits. Devant eux, aussi, on voit une autre chambre. Ce n'est pas une case. Derrière eux, aussi, on voit d'autres chambres avec beaucoup d'herbes.","Asalaamu aleykum wa rahmatu laah, ba tey it ci biir nataal bi yaa ngi ciy gis benn néegu ñax. Néegu ñax bi nag kenn dëkku ci. Ndax booy xool dañ koo tabax ci ñaari melo. Melo yi nag, am na ci weex, am na ci sokolaa. Ci kow nag ñoo ngi ci teg ay ñax. Ci kanamu néegu ñax bi, ñoo ngi ciy gis ñaari gone. Gone gu mag gi moom moo boot gone gi ci des. Ci séen kanam ñoo ngi ciy gis genn garab. Garab gi mi ngi meññ. Ci seen kanam ba tay it ñoo ngi ciy gis beneen néeg. Néeg bi doonul néegu ñax. Ci seen ginaaw ba tay ñoo ngi fay gis yeneen néeg ak ay ñax yu bare."
"Ceci est un lieu d'habitation qui contient un bahut, avec un miroir et des vivres à l'intérieur.","Lii ab dëkkuwaay la, ab dëkkuwaay am ab bayo ci biir, am ab seetu, am ay nekkukaay ci biir."
Sur une photo qui date d'il y a trente trois ans j'y vois un frigo de couleur gris. Il semble que le poigner soit noir. Il est dans un espace complètement blanc.,Nataalu fanweer ak ñett maa ngi ciy gis ab benn frigot boo xam ne couleur bi dafa gris. Dafa mel ni fi ngay jàpp dafa ñuul. Mi ngi nekk ci barab bu weex tàll.
Cette photo montre certainement une sorte de douche qui est très large. À l'intérieur de la douche il y a des outils que tu peux te servir après avoir fini.,"Waaw nataal bii mi ngi wane ab ab wanag lii ab wanag la, wanag bu yànji sax. Ci biir wanag bi nag am nay am na jëfandikaay yoo xam ne ngir boo jëfandikoo ba pare man nga koo jël daal."
"Ceci se trouve dans les toilettes. <mask> cette chose blanche là c'est une allée de douche... c'est une allée de toilettes. C'est à travers qu'on marche pour atteindre les toilettes. Si tu veux assoupir tes besoins tu peux le faire là-bas. Il y a aussi quelque chose à côté. Ça aussi, si tu veux prendre tes abolitions, ou faire pipi, tu peux le faire là-bas.","Waa lii, ci wanag lay nekk. Ndee lu weex lii demukaayu duus la... Demukaayu wanag la. Ci la ñuy demee wanag. Boo bëggee dox aajo man nga fee dox aajo. Am nale lu nekk ci wet gi tamit. Moomit soo bëggee jàpp wala sawi man nga ko faa defee."
"Ceci est une tasse qui contient du lait. C'est une tasse blanche, posée, contenant du lait.",Lii ab kaas la mi ngi def am soow. Ab kaas bu weex la bu def am soow ñu taaj ko.
"Sur cette photo il y a, semble-t-il, des bancs.",Nataal bii lu mel ni ay bãŋ la.
Ceux-ci sont des portes que les menuisiers métalliques ont conçues. Les portes ont été conçues et étalées pour être ensuite peintes en gris. Il semble que la porte soit en réalité deux portes de sorte à ce qu'elle ressemble à une porte de salon.,"Waaw nataal bii de ay bunt yu dóomu-taal moo ci nekk. Bunt yi ëe dafa dóoomu-taal waawaw! Am na ay lu mel ni ay fu ngelaw di jaar boo ko xëccee waaw! Mën nga, mën nga ko xëcc, bunt yi waaw. Du benn bunt nag."
"Oui, sur cette photo, c'est des portes en gris qui y sont. Les portes sont, belle et bien, en gris ! Il y a quelque part où l'air passe si tu tires ! Tu peux tirer les portes si tu veux. Par contre, ce n'est pas une seule porte.","Waaw nataal bii de ay bunt yu dóomu-taal moo ci nekk. Bunt yi ëe dafa dóoomu-taal waawaw! Am na ay lu mel ni ay fu ngelaw di jaar boo ko xëccee waaw! Mën nga, mën nga ko xëcc, bunt yi waaw. Du benn bunt nag."
"Sur cette photo, il y a du verre. Cependant, le verre est composé de plusieurs verres superposés. Aucun de ces verres ne ressemble à l'autre. Le verre, il y a un objet qui le tient et qui est sur le sol. Oui, un objet qui le tient.","Nataal bii de nataal la boo xam ne verre la, verre bi nag mi ngi nekk weer weer yoo xam ne dañoo tegalante, verre yi nag benn bokku ceek moroomam waaw. Verre bi am na affaire bu ko tée boo xam ne mi ngi ci suuf, waaw affaire bu ko tée."
"Ce que j'ai vu c'est une pierre à feu. Je crois, assurément, que c'est une pierre entourée de ciment, de sable et d'eau !","Man de Li ma gis mooy benn lakku doj la. Yaakaar naa aw xeer ñu wërële ko ay, ay kii ay 'ciment' ak suuf ak ndox, waawaaw!"
"Sur cette photo, il y a deux endroits pour s'allonger, deux lits. Sur l'un, on y a posé un oreiller et étalé un drap. Sur l'autre qui est en bas, on n'y a ni posé d'oreiller ni étalé de drap.",Nataal bii ñaari tëddukaay la ñaari lal la. Benn ba teg nañ ca njegenaay lal ca darab. Benn bi ci suuf teguñu ci njegenaay kenn laluñ ci dara.
"Sur la photo que vous m'avez envoyée, j'y ai vu des nattes tissées, superposées. Si tu regardes, on les a tissées d'une très belle manière.","Nataal bii ngeen ma yónnee, gis naa ci biir nataal bi basaŋ yuñ ràbb, tegele leen. Boo xoolee, biñ leen ràbbe rafet nañ lool sax."
Cela est une chaise de la rue 'la jardin public'. On la passe à ceux qui traversent. Ceux qui veulent se reposer auprès d'un fleuve peuvent venir s'asseoir et discuter.,Lii ay toogukaayu mbedd la jardin public. Ñu ngi jagleel ñii di rombu ñii bëgg a noppaleeku ci ab gox mën nañu ñëw toog fii toog waxtaan.
"Cela est une photo. Je vois, dessus, deux femmes assises là-bas portant des calebasses en bois. Ce sont des calebasses en bois et des sceaux.",Waaw lii de ab nataal la boog. Maa ngi gis ñaari jigéen yu toog noonu yor ay leget yu dénk. Leget la yu dénk ak ay paan.
"Cela est ce qu'on appelle 'La tour la plus haute du Sénégal'. Il s'agît du monument de la Renaissance Africaine. C'est le bâtiment sur lequel les gens ont l'habitude de se rencontrer. Il peut s'agir de ceux qui s'échauffent, de ceux qui font un concert, ou de ceux qui font de la gymnastique. Tout ce monde s'y rencontre. C'est une place publique sur laquelle tout le monde se retrouve. N'importe qui qui a un évènement qui peut s'y faire il peut aller le faire là-bas. De ce fait tout le monde y sera. Il y a des étrangers qui viennent le visiter. Le monument présente un père, une mère et leur fils. Le fils pointe le doigt quelque part. Le père a saisi la mère au niveau du bassin.","Lii na ñuy wax 'la tour la plus haute au Sénégal', mi ngi nekk 'Monument de la Renaissance Africaine'. Mi ngi nekk barab bi ñu bare di daje. Moo xam ñiy tàngal séen yaram, ñiy def i kõseer, moo xam ñiy def simnastig. Ñoom ñépp a fay daje. Palaas publig la boo xam ni bii ñoom ñépp a fay daje. Képp ku am xew-xew boo xam ni bii xaj na fa dangay ñów nga defe ko fa. Bu ko defee ñépp ñëw. Am na ci ñoo xam ni tàggat yaram moo leen fa aandi. Am na ñoo xam ni da ñuy jóge dëkk ak dëkk, ñów di ko wisite si. Monimaŋ bi, ñi ngi ko jëmale pàpp yaay ak doom. Doom jaa ngi joxoñ, baay ji téyee yaay ji ci ndigg li."
"Sur la photo que j'ai reçue, il y a une sorte de Palais. Cependant le Palais comprends des gardes du corps qui le garde. En plus, il y a deux lions qui l'entourent. Le Palais ressemble au palais du Sénégal. En plus, il a des feuilles vertes et le bâtiment du palais est complètement blanche.","Nataal bii ma jot dee, Palais lay nuru waaye Palais bi nag am na ay garde corps yoo xam ne ñi ngi koy gardé, ba noppi mu am ñaari gaynde yoo xam ni ñoo ko séq. Palais bi nag paleb Senegaal lay nuru, ba noppi mu am ay xob yu wert ba noppi Palais bi bâtiment bi daa weex tàll."
"Sur la photo se trouve un garçon monté sur une moto. Un garçon qui détient une moto. Il y a des personnes à son coté.  Il porte des habits bleus. Le moto comporte une couleur blanche et une couleur noire... Il y a des personnes courbées là-bas, portant des habits rouges.","Waaw nataal bi de waa ji war ab moto la. Genn góor gu yab ab moto. Am na ñu nekk ci wetam. Mu ngi sol Lu bula, moto bi am na lu weex am na lu ñuul... Am na ñu sëgg nee sol yu xonq"
"Ceux-là, aussi, sont des gendarmes. Ils siègent à la gendarmerie nationale. Eux, cependant, leur travail est de garantir la protection du dirigeant du pays. On les appelles en français 'garde rouge', 'garde rapprochée', ou 'garde présidentielle'. C'est à eux qu'on confie la part de protection du dirigeant du pays.","Ñii moom tamit ay takk-der nañ. Ñi ñi ngi bàyyikoo ci sàndarmëri nasiyonaal. Ñoom nag seen njariñ mooy di aar kaaraange njiitu réew mi. Ñu leen di tudde ci tubaab 'garde rouge, garde rapprochée ou garde présidentielle'. Ñoom la ñuy dénk wàllu kaaraange njiitu réew mi."
"Quatre agents de police, les deux portent leurs <mask> venant séparer les deux se battant sur le sol. Il y a le sommet d'un arbre sur le coté et un homme arrivant.","Ñenti alkaati, ñaar ñi yor seen bat ñow di àtte ñaar ñu nekk di xeex tëdd ci suuf. Mu am benn taatu garab bu nekk ca wet ga, am benn waay bu ñëw."
"Ceux-là sont des femmes policières. Elles sont nombreuses, portant des armes, des gangs blancs et un chapeau. Le chapeau aussi comporte des traits blancs, au-dessus. Elles portes des habits de couleur noir, précédée d'une couleur blanche.","Lii nag ay pólisee yu jigéeñ la. Ëe bari nañu lool, ñu ràngoo ay fetal, sol ay gā yu weex, sol ay mbaxana, ëe, mbaxana mi tamit am na ay rëdd yu weex ci kaw, ak ay yére yu ñuul, jiital lu weex."
"Ah c'est ce qu'on avait dit. Ce sont des policiers accompagnés de leur chef. C'est eux que l'on voit debout. Leur chef, cependant, se trouve là-bas. Il semble qu'ils doivent se mettre debout et tendre les bras; à ce qu'on voit.",Aaa mooy li ñu waxoon rekk ñii ay policiers lañ ñoo xam ni da ñu ànd ak seen seef. Ñoom la ñu gis ñu nekk taxaw nii. Seen seef bi nag moo nekk nee. Xay na nag da ñoo war a taxaw rekk coster les bras nii ci li ñu man a gis nii.
"Sur cette photo ci, cependant, il y a des personnes qui sont debout et se révoltent, c'est-à-dire, qui manifestent, prenant des pierres et les lançant contre les gendarmes. Il y a, cependant, une personne devant qui ne porte pas de masque, portant des pierres et les lançant. Il porte un sous-vêtement blanc et un pantalon noir. Il a, cependant, un boubou rouge au milieu de son derrière.","Nataal bii nag, ay nit lañ yu taxaw di ñaxtu, maanaam di manifestewu, di jël ay xeer di leen sànnanteek takk-der yi. Am na nag ku nekk ci kanam nii solul maska, yor ay xeer di leen sànni. Mi ngi sol siletmaa bu weex ak tubéy ju ñuul. Mi ngi takk nag mbub lu xonq ci digg ginaaw gi."
"Oui ceci, cependant, il s'agit d'un policier qui porte une arme, ayant attaché son bassin et poursuivant ce jeune qui court.","Waaw lii nag ab alkaati bu yor ngànnaayam, takk ndiggam di dàq ndaw sii di dem."
"Sur cette photo datant d'il y a trente sept ans, j'y vois, semble-t-il, <mask> poisson. C'est un poisson qui a aussi des couleurs. Les couleurs aussi y'en a du bleu, du marron, du blanc, et ce qui l'entoure c'est du blanc.","Nataalu fanweer ak juróom-ñaar, maa ngi ci gis lu mel ne lu taxam taxawaayu jën. Jën la woo xam ne itam dafa am ay kulëer. Kulëer yi tamit am na bulë, am na marõ, am na weex, lu ko wër lépp lu weex la."
