french,wolof
Quelqu'un est parti !,Nit dem na !
Homme est parti !,Nit dem na !
Un homme est parti !,Nit dem na !
J'ai vu lion.,Gis naa gaynde.
J'ai vu un lion.,Gis naa gaynde.
Cet homme près de moi.,Nit kii ci sama wet.
Cet homme là près de toi.,Nit kookuu ci sa wet.
Tu vois cet homme là-bas ?,Gis ŋga nit kale ?
"Tu sais, cet homme ?",Gis ŋga nit kookale ?
Tu vois cet homme là ?,Gis ŋga nit kee ?
"Tu sais, cet homme là ?",Gis ŋga nit kookee ?
"Tu vois, cet homme là ?",Gis ŋga nit kookee ?
J'ai vu l'homme.,Gis naa nit ki.
J'ai vu la femme.,Gis naa jigéen ju.
Regarde ce lutteur.,Xoolal mbër mu.
Regarde ce semblant de lutteur.,Xoolal mbër mu.
Regarde cette aumône.,Seetal sarax su.
Tu as vu l'homme ?,Gis ŋga nit ka ?
"Tu as vu, auparavant, l'homme ?",Gis ŋga nit ka ?
Tu connaissais la jeune fille ?,Xamoon ŋga jaŋx ba ?
Tu reconnais cet individu-là ?,Xammee ŋga waa jooju ?
Tu avais reconnu la femme ?,Xammeewoon ŋga jigéen jooju ?
Cet homme a étudié,Nit kii jaŋg na
Ces jeunes gens sont sages.,Xale yile yarunañu.
Je parle de cette dame que voilà !,Jigéen jale laa wax !
Je parle de ce petit.,Xale buu laa wax.
Cette femme-ci n'est pas partie.,Jigéen jule demul.
Ces enfants que voilà ne sont pas sages.,Xale yule yaruwuñu.
Tu connais cet enfant là-bas ?,Xam ŋga xale bee ?
C'est ces livres là-bas que j'ai achetés !,Téere yee laa jënd !
Cause avec cet homme qui est à côté !,Waxtaanal ag nit kookii ci sa wet !
Tu vois ces femmes-là ?,Gis ŋga jigéen ñooñii ?
Nourris cette vache-ci !,Mayal nag wile !
Tu connais cet homme-là ?,Xam ŋga nit kookuu ?
Tu as vu ces jeunes gens ?,Gis ŋga xale yooyule ?
Je parle de la personne qui est sortie !,Nit kookuu génn laa wax !
Tu avais vu cette femme ?,Gisóon ŋga jigéen joojule ?
Je connaissais cet individu-là !,Xamoon naa waa joojee !
J'avais reconnu cette dame-là !,Xammeewoon naa jigéen joojale !
J'ai vu l'enfant.,Gis naa xale ba.
Je parle de cet homme-ci.,Kile nit laa wax.
Ce n'est pas là une belle parole !,Jile wax rafetul !
Cet homme là-bas que tu vois,Kee nit ŋgay gis
C'est ces livres-là qu'il m'a donnés.,Yee téere la ma jóox.
J'ai vu un mouton.,Gis naa am xar.
J'ai aperçu un homme.,Séen naa ak nit.
J'ai aperçu un homme.,Séen naa aw nit.
J'ai aperçu des gens.,Séen naa ay nit.
Quel homme s'est égaré ?,Nit kan a réer ?
Quel mouton s'est égaré ?,Xar man a réer ?
Quel cheval s'est égaré ?,Fas wan a réer ?
Quelle femme s'est égarée ?,Jigéen jan a réer ?
Quelle clé s'est égarée ?,Doom ban a réer ?
Quelle chose s'est égarée ?,Lëf lan a réer ?
Quelle jeune fille s'est égarée ?,Ndaw san a réer ?
Quelles personnes se sont égarées ?,Nit ñan ñoo réer ?
Quels moutons se sont égarés ?,Xar yan ñoo réer ?
Quels chevaux se sont égarés ?,Fas yan ñoo réer ?
Quelles femmes se sont égarées ?,Jigéen ñan ñoo réer ?
Quelles clés se sont égarées ?,Doom yan ñoo réer ?
Quelles choses se sont égarées ?,Yëf yan ñoo réer ?
Quels couteaux se sont égarés ?,Saatu yan ñoo réer ?
Tu parles de quel mouton ?,Xar moomu man ŋga wax ?
Tu parles de ce mouton ?,Xar moomu man ŋga wax ?
Quels moutons avais-tu achetés ?,Xar yii yan ŋga jënd ?
C'est ces moutons que tu avais achetés ?,Xar yii yan ŋga jënd ?
Que j'attrape quelles vaches ?,Ma japp nag yee yan ?
Qu'il attrappe quelles vaches ?,Mu japp nag yooyu yan ?
Tu parles de quelle maison ?,Boobu néeg ban ŋga wax ?
Tu parles de quelle maison ?,Bii néeg ban ŋga wax ?
Tu parles de quelle maison (ici) ?,Bii néeg ban ŋga wax ?
Vous parlez de quelle dame ?,Jile jigéen jan ŋgeen wax ?
Vous parlez de quelle dame (ici) ?,Jile jigéen jan ŋgeen wax ?
Quel cheval veux-tu ?,Woowale fas wan ŋga bëgg ?
Quel cheval veux-tu ?,Yooyale fas wan ŋga bëgg ?
Quels amis sont arrivés ?,Xarit yan ño ñëw ?
Fais sortir tout homme que tu vois !,Génnéel képp nit koo gis !
Fais sortir tout mouton que tu vois !,Génnéel mépp xar moo gis !
Fais sortir tout cheval que tu vois !,Génnéel wépp fas woo gis !
Fais sortir toute vache que tu vois !,Génnéel bépp nag woo gis !
Honore tout homme !,Teralal béppu nit !
Le mouton en entier.,Xar mi mépp.
"Ce boeuf-là, en totalité.",Nag woowa wépp.
Toute cette part que voici.,Wall wuu wépp.
Ce mouton-ci en entier.,Xar mii mépp.
Tout ce mouton.,Xar moomee mépp.
Toute cette partie.,Xar woowalé wépp.
Ce mouton en entier.,Mi xar mépp.
Quel mouton en entier ?,Man xar mépp ?
Ce mouton-là en entier.,Xar moomule mépp.
Va voir tous les hommes !,Seetil nit ñépp !
Va voir tous les moutons !,Seetil xar yépp !
Va voir tous les chevaux !,Seetil fas yépp !
Va voir toutes les vaches !,Seetil nag yépp !
J'ai vu tous ces gens.,Gisoon naa nit ñooña ñépp.
"J'ai vu tous ces gens, auparavant.",Gisoon naa nit ñooña ñépp.
J'ai vu ces gens.,Gisoon naa ñooñale nit ñan.
J'ai vu tous ces moutons-ci.,Gisoon naa xar yi yépp.
J'ai déjà vu tous les moutons.,Gisoon naa xar yi yépp.
J'ai déjà vu tous ces moutons-ci.,Gisoon naa xar yi yépp.
Aucun homme ne s'est égaré.,Nit kenn réerul.
Aucun mouton ne s'est égaré.,Xar menn réerul.
Aucun cheval ne s'est égaré.,Fas wenn réerul.
Aucune clef n'est égarée.,Doom benn réerul.
Aucune dame ne s'est égarée.,Jigéen jenn réerul.
Aucune jeune fille ne s'est égarée.,Ndaw senn réerul.
Rien ne s'est égaré.,Lëf lenn réerul.
Aucun lion ne s'est égaré.,Gayndé genn réerul.
Aucun homme ne s'est égaré.,Kenn nit réerul.
Aucun mouton ne s'est égaré.,Menn xar réerul.
Aucune dame ne s'est égarée.,Jenn jigéen réerul.
Aucun homme n'est venu.,Menn nit ñëwul.
Aucun mouton n'est arrivé.,Menn xar ñëwul.
J'ai acheté le mouton.,Jënd ñaa menn xar mi.
J'ai acheté ce seul mouton !,Jënd ñaa menn xar mi !
J'ai acheté cette unique mouton !,Jënd ñaa menn xar mi !
Cherche un autre homme !,Seetal nit keneen !
Cherche un autre mouton !,Seetal xar meneen !
Cherche un autre cheval !,Seetal fas weneen !
Cherche une autre maison !,Seetal néeg beneen !
Cherche un autre lion !,Seetal gaynde geneen !
Cherche une autre jeune fille !,Seetal ndaw seneen !
Cherche une autre dame !,Seetal jigéen jeneen !
Cherche une autre chose !,Seetal lëf leneen !
C'est un autre cheval que je veux !,Weneen fas la bëgg !
C'est une autre maison que je veux !,Beneen néeg laa bëgg !
C'est un autre lion que je veux !,Geneen gaynde laa bëgg !
C'est une autre épouse que je veux !,Jeneen jabar laa bëgg !
C'est une autre jeune fille que je veux !,Seneen ndaw laa bëgg !
C'est un autre récipient que je veux !,Beneen ndab laa bëgg !
C'est un autre homme que je veux !,Meneen nit laa bëgg !
L'autre homme est venu.,Nit keneen ki ñëw na.
Il parle de l'autre homme.,Keneen nit kooka la wax.
C'est l'autre cheval qui s'est égaré.,Fas weneen wu moo daw.
Je parle de cet autre homme que voilà !,Nit keneen kaa laa wax !
C'est cet autre cheval là-bas qui est bon !,Fas weneen wale moo baax !
Quel autre cheval as-tu vu ?,Weneen fas wan ŋga gis ?
Tout autre mouton que tu vois.,Meneen xar mépp moo gis.
Tous les autres moutons fuirent.,Yeneen xar yi yépp daw.
C'est mon ami !,Sama xarit la !
C'est ton ami !,Sa xarit la !
C'est notre ami !,Suñu sarit la !
C'est votre ami !,Seen xarit la !
C'est leur ami !,Suñu xarit la !
J'ai vu mon ami !,Gis naa sama xarit bi !
J'ai vu mes amis !,Gis naa sana xarit yi !
J'ai vu mes amis !,Gis naa sama xarit yee !
Un ami à moi !,Sama aw xarit !
Tu as vu quels amis à moi ?,Gis ŋga samay xarit yan ?
Tu as vu lesquels de mes amis ?,Gis ŋga samay xarit yan ?
J'ai vu tous tes amis !,Gis naa sa xarit yépp !
Il a vu tous tes amis !,Gis na sa xarit yépp !
J'ai vu tous vos amis en question !,Gis naa seeni xarit yooyu yépp !
Il a vu tous vos amis en question !,Gis na seeni xarit yooyu yépp !
J'ai vu d'autres amis à vous !,Gis naa seen yeneen xarit !
Il a vu d'autres amis à vous !,Gis na seen yeneen xarit !
J'ai vu tes autres amis !,Gis naa sa xarit yeneen yi !
Il a vu tes autres amis !,Gis na sa xarit yeneen yi !
J'ai vu mes autres amis !,Gis naa sama xarit yeneen yooyuu !
Il a vu mes autres amis !,Gis na sama xarit yeneen yooyuu !
Je vois l'homme.,Gis naa nit ki.
Je vois les gens.,Gis naa nit ñi.
Il a vu la dame.,Gis naa jeeg bi.
Il a vu les dames.,Gis naa jeeg ji.
Je connais l'enfant.,Xam naa xale bi.
Je connais les enfants.,Xam naa xale yi.
Il a un mouton.,Am na am xar.
Il a des moutons.,Am na ay xar.
Arrache ces dents-là !,Wekkil gëñ yii !
Range les affaires !,Deñcal yëf yi !
C'est leurs dents !,Seni gëñ la !
De beaux yeux !,Ay bët yu rafet !
C'est quelqu'un qui honore l'homme !,Ku teral nit la !
Tu as vu l'homme ?,Gis ŋga nit ki ?
Tu as vu l'homme ?,Gis ŋga nit ki woon ?
Tu as vu l'homme dont il fut question ?,Gis ŋga nit ki woon ?
Tu as reconnu sa femme ?,Xammee ŋga jabaram joojuwoon ?
Tu as reconnu sa femme d'autrefois ?,Xammee ŋga jabaram joojuwoon ?
Tu te rappelles son amour ?,Gis ŋga coroom la woon ?
Tu te rappelles son amour d'autrefois ?,Gis ŋga coroom la woon ?
Tu vois ce garçon-là ?,Gis ŋga xale bii ?
"Tu vois, ce garçon-là ?",Gis ŋga xale bii woon ?
Tu vois ce garçon-là ?,Gis ŋga xale bii woon ?
Tu reconnais ton amour d'autrefois ?,"Xammee ŋga sa far, woowee woon ?"
Ce fut un homme !,Nit la woon !
C'est un bûcheron.,Aw lawbe la.
C'est le bûcheron !,Lawbe bi la !
C'est votre bûcheron d'autrefois !,Seen lawbe ba woon la !
Ce n'est pas le tambour !,Du sabar gi !
C'est l'étudiant.,Moo di jaŋgkat bi.
C'était son hôte habituellement.,Moo doon ganam.
Tu es quel étudiant ?,Ya di ban jaŋgkat ?
Tu es quel genre d'étudiant ?,Ya di ban jaŋgkat ?
Quel ami serais-tu pour eux ?,Ya di seen ban xarit ?
Si tu es homme,Soo dee góor
Si tu es un homme,Soo dee góor
Sois homme de ce pays !,Dil nitu réew mi !
Sois un homme de ce pays !,Dil nitu réew mi !
Sois l'homme de tout le monde !,Dil nitu nit ñi !
Sois l'homme de la situation !,Dil nitu nit ñi !
Tu étais d'habitude l'hôte de Mustapha,Yaa daan ganu Mustaf
Ce n'est pas un grand tambour.,Du sabar gu rëy.
Je reconnais une vache d'Europe !,Xammee naa nagu Tugël !
Je reconnais les vaches d'Europe !,Xammee naa nagi Tugël !
J'ai vu le fils de la dame.,Gis naa doomu ndaw si.
J'ai vu les enfants de la dame.,Gis naa doomi jigéen ja.
Tu as vu le fils de quelle femme ?,Gis ŋga doomu jigéen jan ?
Tu as choisi la fille d'une femme.,Tann ŋga doomu benn jigéen.
Tu as choisi la fille d'une autre femme.,Tann ŋga doomu benn jigéen.
J'ai vu le fils de l'homme de Gandiole.,Gis naa doomu nitu Gaanjóol gi.
J'ai vu la maison de l'ami de Birayim.,Gis naa këru xaritu Biraayim wi.
J'ai vu la maison de son ami.,Gis naa kër xaritam.
C'est la maison de Birayim.,Kër Biraayim la.
C'est un maître de maison.,Boroom kër la.
C'est la ville de ce Sérère.,Dëkku Séeréer bii la.
C'est cette ville de Sérère.,Gii dëkku Séeréer la.
Tu parles de quelle ville Sérère ?,Gan dëkku Séeréer ŋga wax ?
Tu parles de la ville de quel Sérère ?,Dëkku Séeréer ban ŋga wax ?
Tout village Sérère est propre !,Béppu dëkku Séeréer set na !
Le village de tout Sérère est propre !,Dëkku béppu Séeréer set na !
Il n'est Ardo d'aucun Dieri que tu ne connaisses !,Amul ardo benn Jéeri boo xamul !
J'ai vu l'ovin mâle.,Gis naa xar mu góor ma.
J'ai vu le mouton mâle.,Gis naa xar mu góor ma.
Il a tué une lionne.,Ray na gaynde gu jigéen.
Il a tué les lionnes.,Ray na gaynde yu jigéen ya.
Choisis une jument du Wâlo.,Tannal fasu Waalo wu jigéen.
C'est un homme.,Nit ku góor la.
C'est un homme généreux !,Nit ku baax la !
C'est quelqu'un de bien !,Nit ku baax la !
C'est un homme qui fut bon !,Nit ku baaxoon la !
C'est un homme qui n'est pas bon !,Nit ku baaxul la !
C'est un homme qui eût été bon !,Nit ku baaxkoon la !
C'est cet homme qui eût été bon !,Nit ki baaxkoon la !
C'est cet homme-là qui eût été bon !,Nit kooka baaxkoon la !
Tu es un homme simplement !,Nit doŋŋ ŋga !
Tu es uniquement un homme !,Nit doŋŋ ŋga !
Vous êtes des enfants seulement !,Xaleel rekk ŋgeen !
C'est un homme mûr véritablement !,Mag dëgg là !
L'homme peut-il partir ?,Góor gi dem ?
Que la personne sorte ?,Ndax waa ji génn ?
Afin qu'il se passe quoi ?,Ndax lan am ?
Quelqu'un peut-il partir ?,Ndax kenn dem ?
Alors celui-ci s'en alla !,Noona kooku dem !
Cet homme qui a été,Góor gii demoon
Voila que j'ai été,Maa ŋgii demoon
C'est ce qu'il a dit !,Li mu waxoon la !
C'est ce qu'il a dit qui est vrai !,Li mu waxoon la !
Si l'homme accepte,Su góor gi bëggée
C'est quand tu es venu,Bi ŋga ñëwée la
L'homme n'a pas été,Góor gi demul
Celui-là est parti,Kooku dem na
D'autre sont partis,Ñeñeen dem nañu
Lui il est parti,Moom dem na
L'homme avait été,Góor gi demoon na
L'homme eut été,Góor gi demkoon na
L'homme partit,Góor gi dem
Que l'homme parte ?,Góor gi dem ?
L'homme est parti,Gor gi dem na
Les hommes ne t'ont pas vu,Góor ñi gisuñu la
Que l'homme parte,Na gor gi dem
Que tu partes,Na ŋga dem
Qu'il ne parte pas,Bu mu dem
Alors il partit,Noona mu dem
"S'il parle, je viens",Su waxee më ñëw
C'est lorsque tu t'en allas.,Ba ŋga demee la.
C'est lorsque la femme arriva,Bi jigéen ji ñëwée la
L'homme serait mort,Góor gi deekoon na
L'homme qui eût travaillé,Waa ji liggéeykoon
Ce qu'il eût fait,Li mu defkoon
Car c'est toi qui eûsses été heureux.,Ndax yaa begkoon.
Tu aurais été sans l'y trouver.,Ya ŋgi demkoon doo ka fa fekk.
C'est l'homme qui serait venu,Góor gi moo ñëwkóon
Il demande si tu aurais été,Mi ŋgiy laaj ndax demkoon ŋga
Cherche-les à l'intérieur,Wut leen ci biir
Mais cet homme est parti,Gor gii dem
Cet homme qui a été,Gor gii dem
Que cet homme parte ?,Gor gii dem ?
Voilà que j'ai été pour rien !,Maa ŋgi dem ci dara !
Voilà qu'il a été et qu'il est revenu,Mi ŋgii dem ba delusi
Où a-t-il été ?,Fu mu dem ?
Où veut-il,Fu mu bëgg
Quelle partie veut-il,Fu mu bëgg
Qu'il ne parte pas,Bu ñu dem
L'homme veut,Góor gi bëgg na
"Vous, vous avez été",Yéen dem ŋgeen
"Vous, vous voulez",Yéen bëgg ŋgeen
L'homme ne part pas,Góor gi demul
L'homme ne veut pas,Góor gi bëggul
L'homme n'a pas voulu,Góor gi bëggul
"Si l'homme vient, tout ira !",Su góor gi nëwée lépp baax !
"Quand on ira, tout ira !",Bu nu demee lépp baax !
C'est quand tu as été.,Bi ŋga demee la.
C'est à l'époque où mourut cet homme.,Ba waa ji dee la.
Cet homme qui était parti,Góor gii demoon
Cet homme qui aimait,Góor gii bëggóon
Cet homme qui avait voulu,Góor gii bëggóon
Cet homme qui voulait,Góor gii bëggóon
Voilà que tu as été dans un lieu interdit.,Yaa ŋgii demoon fu ñu la tere.
Où avait-il été ?,Fu mu demoon ?
Comme il avait ainsi été en ce lieu,Noonu mu demoon foofa
L'homme n'a pas été,Waa ji demulwoon
L'homme qui eut été,Góor gi demkoon
Ce qu'il aurait à faire,Li mu defkoon
L'individu serait parti,Waa ji demkoon na
L'individu devait partir,Waa ji demkoon na
C'est lui qui allait,Moo doon dem
C'est lui qui allait habituellement,Moo daan dem
C'est moi qui pars,Maa di dem
C'est moi qui dois partir,Maa di dem
C'est le Laobe.,Moo di Lawbe bi.
L'homme cultive,Góor gi di bày
Mais l'homme cultive,Góor gi di bày
L'homme ne cultivera pas,Góor gi du bày
L'homme ira,Góor gi dana dem
L'homme ira,Góor gi dana demi
L'homme n'a pas été,Góor gi moo demul
Cette personne n'a pas été,Waa jii moo demul
"Toi, tu n'as pas été",Yaa ŋgi demuloo
"Toi que voilà, tu n'as pas été",Yaa ŋgi demuloo
"L'homme est là, il ne vint pas",Góor gaa ŋgi dikkul
Il ne les avait pas vus,Gisu leen woon
Vous ne les aviez pas vus,Gisu leen leen woon
Vous n'y aviez vu personne,Gisu leen fa kenn
Tu n'y avais vu personne,Gisuleen fa woon kenn
Il ne t'avait pas vu,Gisu la woon
Je n'y avais pas été,Demuma fa woon
C'est moi le professeur.,Maa di jaŋgalékat bi.
Cela c'est un baobab.,Loolu di guy.
L'homme qui parle,Góor gii di wax
Cette personne qui parle,Waa ji di wax
L'homme qui part,Góor gi di dem
L'homme partant,Góor gi di dem
Cet homme qui part,Góor gii di dem
Góor giy dem,Góor gi di dem
L'individu était un Laobe.,Waa ji doon Lawbe.
Il était Lebou de Yoff.,Mu doon Lebu Yoff.
C'était un Lebou.,Mu doon Lebu Yoff.
C'est lui qui parlait,Moo doon wax
Le voilà qui partait,Ma ŋgee doon dem
C'est vous qui alliez partir,Yeena doon dem
C'est toi qui avais l'habitude d'aller,Yaa daan dem
L'homme qui travaillait d'habitude,Góor gi daan liggéey
C'est toi qui avais l'habitude d'aller,Yaa daawoon dem
Celui-là qui avait l'habitude d'aller,Kooku daawoon dem
L'homme qui avait l'habitude d'aller,Góor gii daawoon dem
Alors qu'il sera en train de partir,Su dee dem
S'il part,Su dee dem
Une fois en chemin,Su dee dem
Quand il partira,Su dee dem
Lorsqu'il a été,Bi mu demee
S'il est Laobe,Su dee Lawbe
S'il est Laobe de Rao,Su dee Lawbe Rao
Si celui-ci est fils de Birayim,Su kii dee doomu Birayim
C'est toi qui aurais parlé,Yaa doonkoon wax
C'est toi qui eusses été élu,Yaa doonkoon falu
C'est moi qui ne pars pas,Maa dul dem
Appelle l'homme qui ne part pas,Wool góor gi dul dem
Appelle celui-là qui ne part pas,Wool kee dul dem
Appelle celui-là qui ne partira pas,Wool kee dul dem
C'est lui qui n'est pas Laobe du Baol.,Moo dul Lawbe Bawal.
Appelle les enfants qui n'iront nulle part.,Wool xale yi dul dem fenn.
"S'il ne vient pas, il verra !",Su ñëwul dana xam !
"S'il ne vient pas, eh bien, il verra !",Su ñëwul dana xam !
S'il n'était pas Laobe,Su dulwoon Lawbe
C'est ce personnage qui n'allait pas partir,Waa ji moo dulwoon dem
C'est lui qui n'avait pas l'habitude de venir,Moo dawulwoon ñëw
"L'homme ne parlait pas, habituellement.",Góor gi daawul wax.
L'homme partira,Góor gi dana dem
Les femmes accepteront,Jigéen ñi danañu naŋgu
Sois homme de vérité !,Dil nitu dëgg !
L'homme ne rentrera pas chez lui.,Góor gi du ñibbi.
L'homme n'est pas un orfèvre.,Góor gi du tëggu wurus.
Tu n'es pas homme de paix !,Doo nitu jamm !
Tu n'es pas un homme de paix !,Doo nitu jamm !
Ce n'était pas un homme de Saint-Louis.,Du woon góoru Ndar.
Il ne serait pas parti,Du woon dem
Vous ne seriez pas venus,Duŋgeen woon ñëw
"Tu ne bavardais pas, en général.",Yaw daawuloo coow.
"Les gens n'étaient pas, habituellement, bavards.",Nit ñi daawuñu coow.
"Tu ne bavardais pas, généralement.",Daawuloo woon coow.
"Ceux-ci n'allaient pas, généralement.",Ñii daawuñu dem.
L'homme eût été un savant.,Góor gi doonkoon na boroom xamxam.
Toi tu eusses été notre guide.,Yaw doonkoon ŋga suñu njiit.
Les gens n'eussent pas été des maîtres.,Nit ñi doonkoonuñu ay kaaŋ.
"L'homme, il n'est pas parti ?",Gor gi dafa demul ?
Ceux-ci ne sont pas partis ?,Ñii dañu demul ?
Ceux-là n'ont pas été,Nee dañu demul woon
Celui-ci serait parti,Kii dafa demkoon
Celui-ci allait partir,Kii dafa demkoon
C'est ceux-là qui n'eussent pas été,Ñee dañu demulkoon
C'est un homme de son époque.,Dafa di nitu tay.
C'est lui qui part.,Dafa di dem.
Il doit partir.,Dafa di dem.
C'est un homme de vérité.,Dafa doon nitu dëgg.
Tu ne travaillais pas d'habitude.,Daŋga daawul liggéey.
Nous serions des gens de fortune.,Dañu doonkoon nitu alal.
Moi je partirai,Dama di dem
Il a l'habitude d'aller,Dana di dem
Il avait l'habitude de sortir.,Daan na di génn.
Il ne se manifestait pas d'habitude.,Daawul di feeñu.
C'est lui qui avait l'habitude de travailler.,Moo daawoon di liggéey.
Il m'a vu moi-même.,Gis na ma man mi.
Il m'a vu moi-même que voilà.,Gis na ma man mi.
Je parle de toi-même.,Yaw moomu laa wax.
C'est nous-même qu'il cherche.,Ñun ñii lay set.
Il parle de vous ?,Yéen ñan la wax ?
Il parle de qui de vous ?,Yéen ñan la wax ?
Il parle desquels de vous ?,Yéen ñan la wax ?
Il parle desquelles de vous ?,Yéen ñan la wax ?
Je parle de vous tous !,Yéen ñépp laa wax !
Je ne parle que de toi.,Yaw doŋŋ laa wax.
Je parle de toi seul.,Yaw doŋŋ laa wax.
Je te parle à toi fils de Massar.,Yawum Masaar laa wax.
Toi tu as été,Yaw dem ŋga
L'homme a causé avec toi.,Góor gi waxtaan na ag yaw.
L'homme a parlé avec toi.,Góor gi waxtaan na ag yaw.
"Samba, toi, tu as été","Samba, yaw, yaa dem"
"C'est toi qui l'as vu, lui.",Yaa ka gis moom.
"C'est toi qui l'as vu, lui, Samba.",Yaa ka gis moom Samba.
Il m'a vu !,Gis na ma !
Il m'a vu moi !,Gis na ma man !
"Il ne te parle pas, à toi !",Waxu la yaw !
"Te voilà debout, ici.",Yaa ŋgi tawax.
Nous voilà assis,Ñu ŋgi toog
Le voilà assis là-bas.,Ma ŋgii toog.
"Le voilà, là-bas, qui s'en va",Mu ŋgooguu di dem
"Ceux-là, les voilà.","Ñoonu, ñu ŋgii."
"Moi, me voilà.","Man, maa ŋgi."
"L'homme, le voilà.",Góor gi mi ŋgi.
"L'homme, le voilà.",Góor gaa ŋgi.
En voilà un.,Kenn a ŋgi.
En voilà un autre.,Keneen a ŋgi.
En voilà d'autres.,Ñeneen a ŋgi.
Me voilà parti.,Ma ŋgii dem.
"Sur ces entrefaites, moi, je quittais.","Noonu, man, më dem."
"Te voila, tu as été","Yaa ŋgi, dem ŋga"
Dis à l'homme de partir !,Waxal góor gi mu dem !
Dis à l'homme qu'il parte !,Waxal góor gi mu dem !
Dis à d'autres de partir !,Waxal ñeñeen ñu dem !
"Sur ces entrefaites, je partis.",Noonu ma dem.
C'est ce que nous avons dit.,Li ñu wax la.
C'est là que vous seriez allés.,Fi ŋgeen demkoon la.
Que je ne parte pas !,Bu më dem !
Ne partons pas !,Bu ñu dem !
Qu'ils ne partent pas !,Bu ñu dem !
"Ceux-là, il ne les apprécie guère !",Yooyale deey bëggu leen !
"Ceux-là, il ne les apprécie pas !",Yooyale deey bëggu leen !
Tu as vu qui ?,Gis ŋga kan ?
Afin que parte qui ?,Ndax kan dem ?
Afin que parte ?,Ndax kan dem ?
Afin que qui parte ?,Ndax kan dem ?
Lesquels sont arrivés ?,Yan ñoo yeksi ?
Tu as vu qui ?,Daŋga gis kan ?
Quel homme as-tu vu ?,Daŋga gis kan ?
Lequel as-tu vu ?,Jan ŋga gis?
L'homme n'en a pas vu un autre.,Góor gi gisul meneen.
Où est l'eau que tu avais puisée ?,Ana ndox mi ŋga duyóon ?
Le tout s'est renversé.,Lépp tuuru na.
Le tout est épuisé.,Lépp jeex na.
Tous ceux-là doivent partir !,"Ñooñu, ñépp dañuy dem !"
Je cherche celui qui s'est échappé.,Benn bi rëcc laay seet.
Je cherche celui l'un qui s'est échappé.,Benn bi rëcc laay seet.
C'est celui-là que je te donne.,Benn boobule laa la may.
C'est celui-là celui-là l'un que je te donne.,Benn boobule laa la may.
Surveille-moi ceux-là !,Seetal ma ñenn ñuu !
Surveille-moi les-uns que voilà !,Seetal ma ñenn ñuu !
Lequel n'as-tu pas vu ?,Benn ban ŋga gisul ?
L'un lequel n'as-tu pas vu ?,Benn ban ŋga gisul ?
Prends l'un !,Fabal benn bii bépp !
Prends l'un en entier !,Fabal benn bii bépp !
Converser avec lequel ?,Waxtaan ak kenn kan ?
Converser avec l'un lequel ?,Waxtaan ak kenn kan ?
Prends celui-là en entier !,Fabal benn boobu bépp !
Il a vu l'autre.,Gis na keneen ki.
Cet autre-là est un ami à lui.,Keneen kookale xaritam la.
Qui d'autre veut partir ?,Keneen kan moo bëgg dem ?
"N'importe lequel, qui s'échappe",Mépp mu rëcc
Lesquels as-tu vus ?,Ñépp ñan ŋga gis ?
Tous lesquels as-tu vus ?,Ñépp ñan ŋga gis ?
Un seul est arrivé,Menn doon na ñëw
J'ai vu celui-là.,Gis naa kooku woon.
"J'ai vu celui-là, auparavant.",Gis naa kooku woon.
J'ai vu ceux-là.,Gis naa ñooñale woon.
"J'ai vu ceux-là, auparavant.",Gis naa ñooñale woon.
J'ai vu celui en question.,Gis naa ki woon.
"J'ai vu celui en question, auparavant.",Gis naa ki woon.
J'ai vu celui-là.,Gis naa ka woon.
J'ai vu celui dont il fut question.,Gis naa ka woon.
L'un est parti,Kenn ki woon dem na
"L'un, dont il fut question, est parti",Kenn ki woon dem na
J'ai vu l'autre.,Gis na keneen ki woon.
"J'ai vu l'autre, dont il fut question.",Gis na keneen ki woon.
Mais c'est celui-ci.,Mu di kii.
Mais c'était celui-là.,Mu doon kookee.
Ce n'est pas l'autre.,Du keneen ki.
Tu es qui ?,Ya di kan ?
Pour qui te prends-tu ?,Ya di kan ?
Mais ce sont les autres.,Mu di ñeneen ñi.
Où vas-tu ?,Fan ŋga jëm ?
Comment vas-tu ?,Nan ŋga def ?
Là-même où tu as été.,Foofu ŋga dem fu.
Là où tu as été là.,Foofu ŋga dem fu.
Là où tu as été.,Fi ŋga dem foofile.
Ce que tu as dit.,La ŋga wax la.
Tu as dit cela.,La ŋga wax la.
Ce que tu as dit.,Li ŋga wax loolu.
Tu as dit cela même.,Li ŋga wax loolu.
Cela que tu as fait.,Ni ŋga def noonu.
Cela même que tu as fait.,Ni ŋga def noonu.
Cet autre lequel ?,Lenn loolule lan ?
C'était ainsi.,Noonu la woon.
C'est qu'il s'agit d'autre chose.,Dafa di leneen.
C'est que c'est autre chose.,Dafa di leneen.
C'est autre chose.,Dafa di leneen.
"Et pourtant, j'ai été","Moontin, dem naa"
"Le lion n'a pas fui, pourtant.","Gaynde gi dawul, moontin."
"Et pourtant, les enfants sont venus","Moontin, xale yi ñëw nañu"
"Et pourtant, je l'ai vu","Moontin dey, gis naa ka"
"Et pourtant, il veut partir","Moontin nag, bëgg na dem"
Et pourtant ils se connaissent.,Te moontin xamante nañu.
"Dans ce cas, je pars","Bon nag, maa ŋgi dem"
"Dans ce cas, qu'il rentre","Bonag, dey mu ñibbi"
"Dans ce cas, fuis !","Kon nag, dàwul !"
"Alors, ne partez pas","Kon nag dey, buleen dem"
"Malheureusement, nul n'a été","Waaye, kenn demul"
"Du reste, nul n'ira","Waaye sax, kenn dafa dul dem"
"Malheureusement, les enfants ne veulent pas","Waaye nag, xale yi bëggunu"
"Mais, celui qu'il voit, meurt.","Waaye de, ku mu gis, ŋga de."
"Tu n'as pas été, non plus","Wante itam, demuloo"
"Mais, les enfants sont toute-fois méchants.","Wande it, xale yi dañu soxor."
"Mais, nul ne lui a prêté oreille.","Wande nag, kenn dégluwu ka."
"Mais, c'est tout le monde qui est rentré.","Moom daal, ñépp ñibbisi nañu."
"Ainsi donc, personne ne veut partir","Waaw nak, kenn bëggul dem"
"Eh bien, est-ce qu'il est parti ?","Waaw, waaw ndax dem na ?"
"Ainsi, nul ne parle","Moom nak, kenn du wax"
"Ainsi, l'homme ne veut pas partir","Ba, góor gi bëggul dem"
"Ainsi, ma mère n'a pu te voir","Ba nag, sama yaay fafu la gis"
Et tu n'as été nulle part ?,Te demuloo fenn ?
"D'ailleurs, on ne peut rien y voir.","Te nag, kenn manu fi gis dara."
"D'ailleurs, je m'en vais !","Te sax, ma ŋgii dem !"
